{
  "schema_version": "1.0",
  "contract_version": "TRUST_CONTROLLED_NON_PRODUCTION_EXECUTION_CALIBRATION_V1",
  "calibration_id": "PEB3-CONTROLLED-NONPROD-20260822",
  "generated_at": "2026-08-22T05:50:30Z",
  "mode": "CONTROLLED_NON_PRODUCTION_CALIBRATION",
  "project_id": "PIE",
  "source_main_sha": "5b5af6fd7f54365dadf5cf233c044507bf349fdf",
  "production_execution_authorized": false,
  "non_production_execution_authorized": true,
  "automation_authorized": false,
  "pilot_authorized": false,
  "target": {
    "provider": "GITHUB",
    "repository": "gycha0109-beep/Project_Intelligence_Engine",
    "resource_type": "PULL_REQUEST",
    "resource_id": "61",
    "environment": "NON_PRODUCTION_CALIBRATION",
    "head_sha": "39ba94c0b847017f1f9f8e315fdbb198c15b65b9",
    "initial_state": "DRAFT"
  },
  "capability": {
    "class": "GITHUB_PR_MUTATION",
    "operation": "MARK_READY_FOR_REVIEW",
    "rollback_operation": "CONVERT_TO_DRAFT"
  },
  "authorization": {
    "required": true,
    "basis": "EXPLICIT_HUMAN_BOUNDARY_AUTHORIZATION",
    "authorization_id": "human-peb3-20260822-continue",
    "authorization_ref": "conversation:2026-08-22:user-continue-after-peb3-boundary"
  },
  "pre_dispatch": {
    "source_head_exact": true,
    "target_precondition_exact": true,
    "kill_switch_clear": true,
    "rollback_ready": true
  },
  "dispatch": {
    "attempted": false,
    "suppressed": true,
    "provider_response": null,
    "postcondition_readback": null,
    "postcondition_verified": false
  },
  "rollback": {
    "attempted": false,
    "provider_response": null,
    "postcondition_readback": {
      "state": "open",
      "draft": true,
      "head_sha": "39ba94c0b847017f1f9f8e315fdbb198c15b65b9"
    },
    "postcondition_verified": false,
    "final_target_state_restored": true,
    "restoration_mode": "NO_DISPATCH_STATE_PRESERVED"
  },
  "credential_scope": {
    "transport": "CONNECTED_GITHUB_ACCOUNT",
    "target_scoped": false,
    "proven": false,
    "evidence_ref": null
  },
  "blockers": [
    "TARGET_SCOPED_CREDENTIAL_NOT_PROVEN"
  ],
  "status": "BLOCKED",
  "next_step": "ESTABLISH_TARGET_SCOPED_NON_PRODUCTION_CREDENTIAL",
  "evidence_snapshot_sha256": "e8dbf6e10a51101c5044504dd06a9ae63ef57ef8ee39ad016690ca80a81bf9f2",
  "report_sha256": "3b8b818d7f06a7409f73672e51391b07ced32bec74dfc19474b16fbd871a58cb"
}
